Points,Title,Flair,Post Type,Post Links
25,New execution move. "The Swirly",Gameplay,(v.redd.it),https://old.reddit.com/r/modernwarfare/comments/k3cltt/new_execution_move_the_swirly/
24,Imagine being that sniper,Gameplay,(v.redd.it),https://old.reddit.com/r/modernwarfare/comments/k1hz8f/imagine_being_that_sniper/
23,Video not mine but had to share it. Double execution glitch and it looks awesome,Gameplay,(v.redd.it),https://old.reddit.com/r/modernwarfare/comments/k3un11/video_not_mine_but_had_to_share_it_double/
22,You may not like it but this is what peak performance looks like,Video,(v.redd.it),https://old.reddit.com/r/modernwarfare/comments/k0ykso/you_may_not_like_it_but_this_is_what_peak/
21,The Fastest Fingers in the West,Gameplay,(v.redd.it),https://old.reddit.com/r/modernwarfare/comments/k2bbtm/the_fastest_fingers_in_the_west/
20,Hey iw no one wanted this,Discussion,(i.redd.it),https://old.reddit.com/r/modernwarfare/comments/k0aeg2/hey_iw_no_one_wanted_this/
19,Some kind stranger protected me with a trophy system and claymore while I was in a chopper <3,Video,(v.redd.it),https://old.reddit.com/r/modernwarfare/comments/k18gu2/some_kind_stranger_protected_me_with_a_trophy/
18,What happens to the game when you're trying to get launchers platinum and go 4-30 every match for almost a week,Video,(v.redd.it),https://old.reddit.com/r/modernwarfare/comments/k2l2rj/what_happens_to_the_game_when_youre_trying_to_get/
17,"Dinnnnnnng!",Gameplay,(v.redd.it),https://old.reddit.com/r/modernwarfare/comments/k2m7a6/dinnnnnnng/
16,the lightning in this spot of st. petrograd does something weird to Damascus... what could have been...,Video,(v.redd.it),https://old.reddit.com/r/modernwarfare/comments/k05bzc/the_lightning_in_this_spot_of_st_petrograd_does/
15,First time I get a juggernaut in infected. I’m so bad.,Video,(v.redd.it),https://old.reddit.com/r/modernwarfare/comments/k36upl/first_time_i_get_a_juggernaut_in_infected_im_so/
14,After a nice double kill I panic hipfired a headshot. This is probably my peak and it was totally unintentional.,Video,(v.redd.it),https://old.reddit.com/r/modernwarfare/comments/k2ytc6/after_a_nice_double_kill_i_panic_hipfired_a/
13,I’m loving MW year 2 so far,Discussion,(self.modernwarfare),https://old.reddit.com/r/modernwarfare/comments/k0t6na/im_loving_mw_year_2_so_far/
12,Deep In The Camping Lines,Gameplay,(v.redd.it),https://old.reddit.com/r/modernwarfare/comments/k2q1yd/deep_in_the_camping_lines/
11,APC vs. Gunship,Video,(v.redd.it),https://old.reddit.com/r/modernwarfare/comments/k1fh0d/apc_vs_gunship/
10,Avoiding nuclear disaster 0:00:1,Gameplay,(v.redd.it),https://old.reddit.com/r/modernwarfare/comments/k3svmb/avoiding_nuclear_disaster_0001/
9,If Modern Warfare soldiers had a 30 Years Reunion clip,Creative,(v.redd.it),https://old.reddit.com/r/modernwarfare/comments/k0bzee/if_modern_warfare_soldiers_had_a_30_years_reunion/
8,Play smarter.,Gameplay,(v.redd.it),https://old.reddit.com/r/modernwarfare/comments/k0299s/play_smarter/
7,Old man's a gamer,Gameplay,(v.redd.it),https://old.reddit.com/r/modernwarfare/comments/k149mn/old_mans_a_gamer/
6,My Girlfriend Made My Favourite Charm Looks Pretty Sick,Video,(v.redd.it),https://old.reddit.com/r/modernwarfare/comments/k1otss/my_girlfriend_made_my_favourite_charm_looks/
5,My 2yr old daughter gameplay ... teach them from young,Gameplay,(v.redd.it),https://old.reddit.com/r/modernwarfare/comments/k3x3mc/my_2yr_old_daughter_gameplay_teach_them_from_young/
4,Have not seen this happen before draw in TDM,Video,(v.redd.it),https://old.reddit.com/r/modernwarfare/comments/k1kyi3/have_not_seen_this_happen_before_draw_in_tdm/
3,This clip is old but it checks out,Gameplay,(v.redd.it),https://old.reddit.com/r/modernwarfare/comments/k2qu7f/this_clip_is_old_but_it_checks_out/
2,This is the peak of my COD gaming,Gameplay,(v.redd.it),https://old.reddit.com/r/modernwarfare/comments/k1fmwf/this_is_the_peak_of_my_cod_gaming/
1,Blinding Lights - A FFA Nuke,Gameplay,(streamable.com),https://old.reddit.com/r/modernwarfare/comments/k2nm42/blinding_lights_a_ffa_nuke/
