Points,Title,Flair,Post Type,Post Links
25,100% accuracy 5 one-tap ace,Gameplay,(v.redd.it),https://old.reddit.com/r/GlobalOffensive/comments/kgnp9r/100_accuracy_5_onetap_ace/
24,Grenade bullet block saved me lol,Fluff,(v.redd.it),https://old.reddit.com/r/GlobalOffensive/comments/kg54hn/grenade_bullet_block_saved_me_lol/
23,14.99 meters is more than 15 meters,Fluff,(i.redd.it),https://old.reddit.com/r/GlobalOffensive/comments/ke69my/1499_meters_is_more_than_15_meters/
22,Magisk was way too happy to kill chicken...,Stream Highlight | Esports,(v.redd.it),https://old.reddit.com/r/GlobalOffensive/comments/kgxdfc/magisk_was_way_too_happy_to_kill_chicken/
21,What do you think about this crosshair outline option? (removed corners of the outline),Discussion,(i.redd.it),https://old.reddit.com/r/GlobalOffensive/comments/kf2set/what_do_you_think_about_this_crosshair_outline/
20,What Broken Fang Premier is actually like,Fluff,(i.redd.it),https://old.reddit.com/r/GlobalOffensive/comments/kcx1x6/what_broken_fang_premier_is_actually_like/
19,CT agent go brrrrrr,Gameplay,(v.redd.it),https://old.reddit.com/r/GlobalOffensive/comments/kfhbyi/ct_agent_go_brrrrrr/
18,SPUNJ's quarantine casting setup,Fluff | Esports,(i.imgur.com),https://old.reddit.com/r/GlobalOffensive/comments/kdlieq/spunjs_quarantine_casting_setup/
17,15.02 meters is less than 15 meters,Feedback,(i.redd.it),https://old.reddit.com/r/GlobalOffensive/comments/kdwr82/1502_meters_is_less_than_15_meters/
16,s1mple's stats at IEM Global Challenge have reached the limit and need the lines extended,Fluff | Esports,(i.redd.it),https://old.reddit.com/r/GlobalOffensive/comments/kfqr0g/s1mples_stats_at_iem_global_challenge_have/
15,Sergej on Twitter: I wouldn't take everything what @alluCSGO said/says as granted. He isn't as simple and harmless persona as it may look. Theres a reason hes the only one left in the team from the original roster.,Discussion | Esports,(twitter.com),https://old.reddit.com/r/GlobalOffensive/comments/kd5jbp/sergej_on_twitter_i_wouldnt_take_everything_what/
14,fine little wingman jump with a man completely clueless of his surroundings,Fluff,(v.redd.it),https://old.reddit.com/r/GlobalOffensive/comments/kgbdlv/fine_little_wingman_jump_with_a_man_completely/
13,How BIG's beautiful B take looks in radar,Gameplay | Esports,(v.redd.it),https://old.reddit.com/r/GlobalOffensive/comments/kei4e8/how_bigs_beautiful_b_take_looks_in_radar/
12,OFFICIAL: Twistzz steps down from Team Liquid,News & Events | Esports,(clips.twitch.tv),https://old.reddit.com/r/GlobalOffensive/comments/kh0krq/official_twistzz_steps_down_from_team_liquid/
11,Stewie: "Anyone local in Utrecht have a Glorious Model O mouse I can use for the finals tomorrow to beat astralis and i’ll give it right back or sign it. ANYTHING U NEED. it’ll literally be legendary. We’ll hook you up with Team Liquid merch!! RTS APPRECIATED!",Fluff | Esports,(twitter.com),https://old.reddit.com/r/GlobalOffensive/comments/kghadh/stewie_anyone_local_in_utrecht_have_a_glorious/
10,2021 Service Medal Colors,Game Update,(i.redd.it),https://old.reddit.com/r/GlobalOffensive/comments/kfa78x/2021_service_medal_colors/
9,Rain is so good he is the MVP of a match he isn't even in,Fluff | Esports,(i.redd.it),https://old.reddit.com/r/GlobalOffensive/comments/kf5x54/rain_is_so_good_he_is_the_mvp_of_a_match_he_isnt/
8,s1mple knifes two in the vents,Stream Highlight | Esports,(clips.twitch.tv),https://old.reddit.com/r/GlobalOffensive/comments/kdtmco/s1mple_knifes_two_in_the_vents/
7,floppy: "the M4A4 should not be $3100 while the Galil is $1800. they're both the same gun. Fuck This Economy for CT's",Discussion,(twitter.com),https://old.reddit.com/r/GlobalOffensive/comments/kf5z15/floppy_the_m4a4_should_not_be_3100_while_the/
6,HAVU signs Aerial,News & Events | Esports,(youtu.be),https://old.reddit.com/r/GlobalOffensive/comments/keun8s/havu_signs_aerial/
5,OG response for last nights Allu's interview,Fluff | Esports,(twitter.com),https://old.reddit.com/r/GlobalOffensive/comments/kdl5bj/og_response_for_last_nights_allus_interview/
4,Heroic won Nuke in triple OT with no one on the team having positive K-D,Fluff | Esports,(i.redd.it),https://old.reddit.com/r/GlobalOffensive/comments/kf2jq1/heroic_won_nuke_in_triple_ot_with_no_one_on_the/
3,[Autimatic]Just to clear some things up for the time being I'm looking to stay in CSGO. I've loved and played this game for more than half of my life and want to continue if I can. However I'll be playing some Valorant in the next coming weeks to try it out and make my decision then.,Discussion | Esports,(twitter.com),https://old.reddit.com/r/GlobalOffensive/comments/kdeshn/autimaticjust_to_clear_some_things_up_for_the/
2,How ENCE handles all the drama around them,Fluff | Esports,(i.redd.it),https://old.reddit.com/r/GlobalOffensive/comments/kdmzao/how_ence_handles_all_the_drama_around_them/
1,BIG vs Team Liquid / IEM Global Challenge 2020 - Semi-Final / Post-Match Discussion,Discussion | Esports,(self.GlobalOffensive),https://old.reddit.com/r/GlobalOffensive/comments/kggwhm/big_vs_team_liquid_iem_global_challenge_2020/
