Points,Title,Flair,Post Type,Post Links
25,Took the greatest screenshot of my life last night,SCREENSHOT,(i.redd.it),https://old.reddit.com/r/FortNiteBR/comments/k5e660/took_the_greatest_screenshot_of_my_life_last_night/
24,What if... LEGO Fortnite?,HUMOR,(i.redd.it),https://old.reddit.com/r/FortNiteBR/comments/k571dj/what_if_lego_fortnite/
23,Hey Epic let me pay off my parking tickets with gold now so these boots can come off.,SUGGESTION,(i.redd.it),https://old.reddit.com/r/FortNiteBR/comments/k6yn5f/hey_epic_let_me_pay_off_my_parking_tickets_with/
22,C'mon Galactus,HUMOR,(i.redd.it),https://old.reddit.com/r/FortNiteBR/comments/k4uivr/cmon_galactus/
21,[Art] Fortnite: Zero Point A Cinematic Film,EPIC REPLY,(i.redd.it),https://old.reddit.com/r/FortNiteBR/comments/k7z9qi/art_fortnite_zero_point_a_cinematic_film/
20,Oh no,EPIC REPLY,(i.redd.it),https://old.reddit.com/r/FortNiteBR/comments/k6ixyz/oh_no/
19,New way to get infinite free wins,BUG,(v.redd.it),https://old.reddit.com/r/FortNiteBR/comments/k770kh/new_way_to_get_infinite_free_wins/
18,Ah Tony even when reality is collapsing you still know how to have a good time,HUMOR,(i.redd.it),https://old.reddit.com/r/FortNiteBR/comments/k5wfur/ah_tony_even_when_reality_is_collapsing_you_still/
17,Who at Epic buffed the T-Pose emote???,BUG,(v.redd.it),https://old.reddit.com/r/FortNiteBR/comments/k78m8e/who_at_epic_buffed_the_tpose_emote/
16,Brite Bomber in different art styles! I worked really hard on this and I hope you like it,ARTISTIC,(i.redd.it),https://old.reddit.com/r/FortNiteBR/comments/k4q2c5/brite_bomber_in_different_art_styles_i_worked/
15,This is what brought DC and Marvel together,SCREENSHOT,(i.redd.it),https://old.reddit.com/r/FortNiteBR/comments/k4uiwc/this_is_what_brought_dc_and_marvel_together/
14,Not our lord and savior Donald Mustard...,SCREENSHOT,(i.redd.it),https://old.reddit.com/r/FortNiteBR/comments/k7cxrt/not_our_lord_and_savior_donald_mustard/
13,Easily my favorite moment of this season so far,CLIP 🎬,(v.redd.it),https://old.reddit.com/r/FortNiteBR/comments/k7glla/easily_my_favorite_moment_of_this_season_so_far/
12,Concept for a challenge section since I'm not going to remember if I destroyed 2500 trees,SUGGESTION,(i.redd.it),https://old.reddit.com/r/FortNiteBR/comments/k8dk0n/concept_for_a_challenge_section_since_im_not/
11,This has to be the most satisfying thing in Fortnite,CLIP 🎬,(v.redd.it),https://old.reddit.com/r/FortNiteBR/comments/k7mox9/this_has_to_be_the_most_satisfying_thing_in/
10,Jonsey is die :(,HUMOR,(i.redd.it),https://old.reddit.com/r/FortNiteBR/comments/k4ukne/jonsey_is_die/
9,"The last thing we need is someone escaping the loop",ARTISTIC,(i.redd.it),https://old.reddit.com/r/FortNiteBR/comments/k5nw3k/the_last_thing_we_need_is_someone_escaping_the/
8,You can now have up to 50 presets!,MEDIA,(v.redd.it),https://old.reddit.com/r/FortNiteBR/comments/k56iqm/you_can_now_have_up_to_50_presets/
7,Nothing is scarier then finding out your hunter is literally behind you when you have no weapons or mats.,ARTISTIC,(i.redd.it),https://old.reddit.com/r/FortNiteBR/comments/k8iypu/nothing_is_scarier_then_finding_out_your_hunter/
6,I’ve seen a lot of hate come to this game and I was happy there was still people who enjoyed it like me,HUMOR,(i.redd.it),https://old.reddit.com/r/FortNiteBR/comments/k4jb3w/ive_seen_a_lot_of_hate_come_to_this_game_and_i/
5,Replace Coral Castle with 'The Block',DISCUSSION,(i.redd.it),https://old.reddit.com/r/FortNiteBR/comments/k7symz/replace_coral_castle_with_the_block/
4,3. fall,HUMOR,(i.redd.it),https://old.reddit.com/r/FortNiteBR/comments/k4mvzg/3_fall/
3,Interesting Galactus Event Glitch didn't ruin the even just confused me,MEDIA,(v.redd.it),https://old.reddit.com/r/FortNiteBR/comments/k4v09s/interesting_galactus_event_glitch_didnt_ruin_the/
2,Mongraals god strafe,CLIP 🎬,(v.redd.it),https://old.reddit.com/r/FortNiteBR/comments/k56ugj/mongraals_god_strafe/
1,Recreated a popular meme,HUMOR,(i.redd.it),https://old.reddit.com/r/FortNiteBR/comments/k606bh/recreated_a_popular_meme/
