Points,Title,Flair,Post Type,Post Links
25,Man I can't wait to see the Galactus Event!,HUMOR,(i.redd.it),https://old.reddit.com/r/FortNiteBR/comments/k04od1/man_i_cant_wait_to_see_the_galactus_event/
24,[Suggestion] It's really hard to find an emote because everything is white. Epic should add the rarity colours to the emotes in the emote wheel so it's easier finding the desired emote due to a discernible visual difference.,SUGGESTION,(i.redd.it),https://old.reddit.com/r/FortNiteBR/comments/k37iqn/suggestion_its_really_hard_to_find_an_emote/
23,TBT when we could solo rocket ride with one of the most fun weapons in the game,MEDIA,(v.redd.it),https://old.reddit.com/r/FortNiteBR/comments/k1dhll/tbt_when_we_could_solo_rocket_ride_with_one_of/
22,I knew something felt off....,HUMOR,(i.redd.it),https://old.reddit.com/r/FortNiteBR/comments/k262x3/i_knew_something_felt_off/
21,Credits to u/cjs1011 for the template,HUMOR,(v.redd.it),https://old.reddit.com/r/FortNiteBR/comments/k0qgwi/credits_to_ucjs1011_for_the_template/
20,Haha Battle Bus go brrrr,HUMOR,(i.redd.it),https://old.reddit.com/r/FortNiteBR/comments/k0d5bp/haha_battle_bus_go_brrrr/
19,Everyone always asks where is Galactus. But no one ever asked how is Galactus.,HUMOR,(i.redd.it),https://old.reddit.com/r/FortNiteBR/comments/k0t613/everyone_always_asks_where_is_galactus_but_no_one/
18,We are all NPCs living in his world,HUMOR,(i.redd.it),https://old.reddit.com/r/FortNiteBR/comments/k3azx8/we_are_all_npcs_living_in_his_world/
17,the distraction,HUMOR,(i.redd.it),https://old.reddit.com/r/FortNiteBR/comments/k118ee/the_distraction/
16,"Inspirational and Motivational" videos these days,MEDIA,(v.redd.it),https://old.reddit.com/r/FortNiteBR/comments/k2po40/inspirational_and_motivational_videos_these_days/
15,Please have mercy wolverine.,HUMOR,(i.redd.it),https://old.reddit.com/r/FortNiteBR/comments/k1r48x/please_have_mercy_wolverine/
14,How the black hole was planned (Via:ShiinaBR),MEDIA,(i.redd.it),https://old.reddit.com/r/FortNiteBR/comments/k2pwmz/how_the_black_hole_was_planned_viashiinabr/
13,If Fortnite Chapter 2 Season 4 had an Anime Opening! - Animation (3 Months in making!),ARTISTIC,(v.redd.it),https://old.reddit.com/r/FortNiteBR/comments/k3k0xr/if_fortnite_chapter_2_season_4_had_an_anime/
12,Guys I think he will fall for it,HUMOR,(i.redd.it),https://old.reddit.com/r/FortNiteBR/comments/k2d3ou/guys_i_think_he_will_fall_for_it/
11,A Fortnite developer showed off how the Chapter island was created. An amazing amount of effort,MEDIA,(v.redd.it),https://old.reddit.com/r/FortNiteBR/comments/k2lqwc/a_fortnite_developer_showed_off_how_the_chapter/
10,This happens to me most of the time,HUMOR,(i.redd.it),https://old.reddit.com/r/FortNiteBR/comments/k2k3d9/this_happens_to_me_most_of_the_time/
9,I drew a Gorger how does it look?,ARTISTIC,(i.redd.it),https://old.reddit.com/r/FortNiteBR/comments/k3xwsb/i_drew_a_gorger_how_does_it_look/
8,I sniped Galactus! I saved Fortnite!,HUMOR,(v.redd.it),https://old.reddit.com/r/FortNiteBR/comments/k3aqjh/i_sniped_galactus_i_saved_fortnite/
7,Fortnite Concept: Daily Random Mystery Skin Randomizer,SUGGESTION,(reddit.com),https://old.reddit.com/r/FortNiteBR/comments/k31n8f/fortnite_concept_daily_random_mystery_skin/
6,Chapter 2 Season 4 Recap by Zenith ;),EPIC REPLY,(v.redd.it),https://old.reddit.com/r/FortNiteBR/comments/k1zsy6/chapter_2_season_4_recap_by_zenith/
5,my friend and I are doing cosplay. this is one of the last works.Lemme know what you think (* ^ ω ^),ARTISTIC,(reddit.com),https://old.reddit.com/r/FortNiteBR/comments/k0jtv1/my_friend_and_i_are_doing_cosplay_this_is_one_of/
4,Seems like a great idea Glakus,HUMOR,(i.redd.it),https://old.reddit.com/r/FortNiteBR/comments/k2i3r0/seems_like_a_great_idea_glakus/
3,president business 😳,EPIC REPLY,(i.redd.it),https://old.reddit.com/r/FortNiteBR/comments/k3bjtt/president_business/
2,Full Live Event Totally Leaked 😳,HUMOR,(v.redd.it),https://old.reddit.com/r/FortNiteBR/comments/k2485c/full_live_event_totally_leaked/
1,When theres no POI in the circle so you gotta make your own,SCREENSHOT,(i.redd.it),https://old.reddit.com/r/FortNiteBR/comments/k0fbty/when_theres_no_poi_in_the_circle_so_you_gotta/
