Points,Title,Flair,Post Type,Post Links
25,Blocked a shatter then 180 blocked a d.va bomb followed up by a 6k shatter,Highlight,(gfycat.com),https://old.reddit.com/r/Overwatch/comments/jxvhf2/blocked_a_shatter_then_180_blocked_a_dva_bomb/
24,Recent patch for Brigitte be like,Humor,(i.redd.it),https://old.reddit.com/r/Overwatch/comments/jxmpnz/recent_patch_for_brigitte_be_like/
23,Flanking for beginners,Humor,(v.redd.it),https://old.reddit.com/r/Overwatch/comments/jzm4oi/flanking_for_beginners/
22,4hp Zenyatta 1v3,Highlight,(v.redd.it),https://old.reddit.com/r/Overwatch/comments/jwbu3r/4hp_zenyatta_1v3/
21,Time to retire this meme,Humor,(i.redd.it),https://old.reddit.com/r/Overwatch/comments/jx7yz0/time_to_retire_this_meme/
20,[photographer] Widowmaker cosplay photoshoot by Dzikan,Fan Content,(i.imgur.com),https://old.reddit.com/r/Overwatch/comments/jvto15/photographer_widowmaker_cosplay_photoshoot_by/
19,Biggest backcap of my career.,Highlight,(gfycat.com),https://old.reddit.com/r/Overwatch/comments/jz8lr2/biggest_backcap_of_my_career/
18,Brigitte Fanart by TeemuTaiga,Fan Content,(i.redd.it),https://old.reddit.com/r/Overwatch/comments/jylpct/brigitte_fanart_by_teemutaiga/
17,My mum painted these for me. I've also got Mercy Moira and Bap in progress,Fan Content,(i.redd.it),https://old.reddit.com/r/Overwatch/comments/jwgtsk/my_mum_painted_these_for_me_ive_also_got_mercy/
16,My son is 6 years old and he loves Genji. Nobody in his school will know who this is but he was jumping for joy when we finished. My little gamer!,Fan Content,(i.redd.it),https://old.reddit.com/r/Overwatch/comments/jxfmn8/my_son_is_6_years_old_and_he_loves_genji_nobody/
15,I dedicate this one to the healers out there... who are tired of dealing with Genji ♥,Highlight,(v.redd.it),https://old.reddit.com/r/Overwatch/comments/jwuta0/i_dedicate_this_one_to_the_healers_out_there_who/
14,Mercy fanart,Fan Content,(i.redd.it),https://old.reddit.com/r/Overwatch/comments/jx1cyu/mercy_fanart/
13,Fan art of ashe,Fan Content,(i.redd.it),https://old.reddit.com/r/Overwatch/comments/jyyf2v/fan_art_of_ashe/
12,My first clean 5k on Widow that actually made POTG,Highlight,(gfycat.com),https://old.reddit.com/r/Overwatch/comments/jy77di/my_first_clean_5k_on_widow_that_actually_made_potg/
11,How to silence a lobby 101,Highlight,(v.redd.it),https://old.reddit.com/r/Overwatch/comments/jz05ol/how_to_silence_a_lobby_101/
10,Little Mcree stop motion movie me and my little brother made.,Highlight,(v.redd.it),https://old.reddit.com/r/Overwatch/comments/jw3tsf/little_mcree_stop_motion_movie_me_and_my_little/
9,He knew he did wrong,Highlight,(v.redd.it),https://old.reddit.com/r/Overwatch/comments/jwi7zq/he_knew_he_did_wrong/
8,That went exactly opposite of how I wanted it to go,Highlight,(v.redd.it),https://old.reddit.com/r/Overwatch/comments/jyyfmr/that_went_exactly_opposite_of_how_i_wanted_it_to/
7,For all my Mercy mains who have had to contest point.,Highlight,(v.redd.it),https://old.reddit.com/r/Overwatch/comments/jx4elj/for_all_my_mercy_mains_who_have_had_to_contest/
6,Oh thanks for letting me know where you are.,Highlight,(v.redd.it),https://old.reddit.com/r/Overwatch/comments/jyub72/oh_thanks_for_letting_me_know_where_you_are/
5,[photographer] Ashe cosplay photoshoot by Dzikan,Fan Content,(i.imgur.com),https://old.reddit.com/r/Overwatch/comments/jvtp0m/photographer_ashe_cosplay_photoshoot_by_dzikan/
4,Me and another Sombra find each other by saying "Boop",Humor,(v.redd.it),https://old.reddit.com/r/Overwatch/comments/jysska/me_and_another_sombra_find_each_other_by_saying/
3,The Competitive Open Queue experience,Humor,(i.redd.it),https://old.reddit.com/r/Overwatch/comments/jw52hr/the_competitive_open_queue_experience/
2,As a silver ranked player this made me happy,Highlight,(v.redd.it),https://old.reddit.com/r/Overwatch/comments/jzbdc6/as_a_silver_ranked_player_this_made_me_happy/
1,Fanart of Pharah,Fan Content,(i.redd.it),https://old.reddit.com/r/Overwatch/comments/jz8ysu/fanart_of_pharah/
