Points,Title,Flair,Post Type,Post Links
25,Baited a loot-hungry squad on Paramo! 😇,Media,(v.redd.it),https://old.reddit.com/r/PUBATTLEGROUNDS/comments/k4kehe/baited_a_loothungry_squad_on_paramo/
24,Bridge trolls getting what they deserve,Media,(v.redd.it),https://old.reddit.com/r/PUBATTLEGROUNDS/comments/k8d56m/bridge_trolls_getting_what_they_deserve/
23,The only time "He's 1 shot" wasn't a complete lie,Media,(v.redd.it),https://old.reddit.com/r/PUBATTLEGROUNDS/comments/k7osmm/the_only_time_hes_1_shot_wasnt_a_complete_lie/
22,lvl 1 helmet is underrated,Highlight,(v.redd.it),https://old.reddit.com/r/PUBATTLEGROUNDS/comments/k5uy8t/lvl_1_helmet_is_underrated/
21,Bartender scared the 💩 out of me.,Media,(v.redd.it),https://old.reddit.com/r/PUBATTLEGROUNDS/comments/k6hzgs/bartender_scared_the_out_of_me/
20,Crossbow from Glider *<:],Highlight,(v.redd.it),https://old.reddit.com/r/PUBATTLEGROUNDS/comments/k6yg1d/crossbow_from_glider/
19,Well that was unexpected.,Highlight,(v.redd.it),https://old.reddit.com/r/PUBATTLEGROUNDS/comments/k5fj80/well_that_was_unexpected/
18,Beautiful escape (sorry for the bad quality),Highlight,(v.redd.it),https://old.reddit.com/r/PUBATTLEGROUNDS/comments/k54lpb/beautiful_escape_sorry_for_the_bad_quality/
17,My PUBG duo partner is the best hype-man a guy could ask for 🤩,Highlight | PUBG Corp. Response,(v.redd.it),https://old.reddit.com/r/PUBATTLEGROUNDS/comments/k57w01/my_pubg_duo_partner_is_the_best_hypeman_a_guy/
16,Meanwhile the R1895 in PUBG shoots like a jammed pew-pew gun,Meta,(youtube.com),https://old.reddit.com/r/PUBATTLEGROUNDS/comments/k79he7/meanwhile_the_r1895_in_pubg_shoots_like_a_jammed/
15,Just in the nick of time...,Media,(v.redd.it),https://old.reddit.com/r/PUBATTLEGROUNDS/comments/k72uz8/just_in_the_nick_of_time/
14,I had no idea this was a thing and it saved my life,Highlight,(v.redd.it),https://old.reddit.com/r/PUBATTLEGROUNDS/comments/k7tpx1/i_had_no_idea_this_was_a_thing_and_it_saved_my/
13,Trade up system has been TEMPORARILY disabled for about 2 years now.,Discussion,(i.redd.it),https://old.reddit.com/r/PUBATTLEGROUNDS/comments/k7vndp/trade_up_system_has_been_temporarily_disabled_for/
12,He's back! - dearsomeone - PUBG Rewind 2020 Trailer,Media,(youtu.be),https://old.reddit.com/r/PUBATTLEGROUNDS/comments/k8lebw/hes_back_dearsomeone_pubg_rewind_2020_trailer/
11,I've had my fun but drive bys might need a nerf. Thoughts?,Highlight,(v.redd.it),https://old.reddit.com/r/PUBATTLEGROUNDS/comments/k7teey/ive_had_my_fun_but_drive_bys_might_need_a_nerf/
10,Choco Driveby DUB with Revolver,Highlight,(clips.twitch.tv),https://old.reddit.com/r/PUBATTLEGROUNDS/comments/k6z3hh/choco_driveby_dub_with_revolver/
9,Respect gained,Highlight,(v.redd.it),https://old.reddit.com/r/PUBATTLEGROUNDS/comments/k5rpz5/respect_gained/
8,I almost didn't get the last guy because I was so confused by what he was doing. My 64th 65th 66th Crossbow Chicken Dinners!,Media | PUBG Corp. Response,(v.redd.it),https://old.reddit.com/r/PUBATTLEGROUNDS/comments/k61u6v/i_almost_didnt_get_the_last_guy_because_i_was_so/
7,Trying to smuggle myself into other player's vehicles,Media,(v.redd.it),https://old.reddit.com/r/PUBATTLEGROUNDS/comments/k6mmov/trying_to_smuggle_myself_into_other_players/
6,I'd heard the rumors but tonight I finally saw it for myself: no less than three people teaming in Solo Ranked EU. Something felt off after a very suspicious death so I decided to do some investigating.,Media,(twitch.tv),https://old.reddit.com/r/PUBATTLEGROUNDS/comments/k4y4at/id_heard_the_rumors_but_tonight_i_finally_saw_it/
5,Season 10 Teaser 2 - Hide Seek Survive,Official,(youtu.be),https://old.reddit.com/r/PUBATTLEGROUNDS/comments/k731gi/season_10_teaser_2_hide_seek_survive/
4,Venting - Very uncomfortable with screenshot feature of PUBG crash reporter,Discussion,(self.PUBATTLEGROUNDS),https://old.reddit.com/r/PUBATTLEGROUNDS/comments/k5ajaq/venting_very_uncomfortable_with_screenshot/
3,Sticky Bombs black zone booms and MG3 spraying! First PUBG night with my friends in looong time! Feels good to be back (and win one).,Media,(v.redd.it),https://old.reddit.com/r/PUBATTLEGROUNDS/comments/k63ni7/sticky_bombs_black_zone_booms_and_mg3_spraying/
2,Miramar Island Ending (4 mins),Media,(streamable.com),https://old.reddit.com/r/PUBATTLEGROUNDS/comments/k6bykb/miramar_island_ending_4_mins/
1,I really really hate that I'm always playing against these level 500 people with God tier aim and ears of eagles,Discussion,(self.PUBATTLEGROUNDS),https://old.reddit.com/r/PUBATTLEGROUNDS/comments/k7jkks/i_really_really_hate_that_im_always_playing/
