Points,Title,Flair,Post Type,Post Links
25,We made Chalet out of gingerbread!,Creative,(reddit.com),https://old.reddit.com/r/Rainbow6/comments/kgzd2a/we_made_chalet_out_of_gingerbread/
24,Double Wallbang Collateral with Kali,Gameplay,(v.redd.it),https://old.reddit.com/r/Rainbow6/comments/kd8034/double_wallbang_collateral_with_kali/
23,I don't remember Mute being such a dick,Fluff,(i.redd.it),https://old.reddit.com/r/Rainbow6/comments/kefwmn/i_dont_remember_mute_being_such_a_dick/
22,Maverick Cosplay. Happy X-mas y'all!,Creative,(i.redd.it),https://old.reddit.com/r/Rainbow6/comments/ke95pc/maverick_cosplay_happy_xmas_yall/
21,Echo's new gadget!,Creative,(i.redd.it),https://old.reddit.com/r/Rainbow6/comments/kfnw12/echos_new_gadget/
20,Iceycat charm is out,Useful,(v.redd.it),https://old.reddit.com/r/Rainbow6/comments/kdnj18/iceycat_charm_is_out/
19,r6siege 2077,Creative,(i.redd.it),https://old.reddit.com/r/Rainbow6/comments/keuwck/r6siege_2077/
18,POV: you're a toxic babe going into position [Animation],Creative,(v.redd.it),https://old.reddit.com/r/Rainbow6/comments/kg93v7/pov_youre_a_toxic_babe_going_into_position/
17,New Arcade Mode: Legacy | December 17th to January 5th,News,(v.redd.it),https://old.reddit.com/r/Rainbow6/comments/kf23is/new_arcade_mode_legacy_december_17th_to_january/
16,I showed you my EDD please respond,Creative,(i.redd.it),https://old.reddit.com/r/Rainbow6/comments/kdlid2/i_showed_you_my_edd_please_respond/
15,I was just trying to get my shotgun kills..,Gameplay,(v.redd.it),https://old.reddit.com/r/Rainbow6/comments/kfh1v2/i_was_just_trying_to_get_my_shotgun_kills/
14,ubisoft stop adding these impossible god damn challenges. this is getting out of hand,Fluff,(i.redd.it),https://old.reddit.com/r/Rainbow6/comments/kf2auc/ubisoft_stop_adding_these_impossible_god_damn/
13,Mozzie really is from Australia!,Gameplay,(v.redd.it),https://old.reddit.com/r/Rainbow6/comments/kehc22/mozzie_really_is_from_australia/
12,Throwback to Mute Protocol and the technique: “Claymore then look like a bot.”,Gameplay,(v.redd.it),https://old.reddit.com/r/Rainbow6/comments/kgqvuo/throwback_to_mute_protocol_and_the_technique/
11,Long live the lord TACHANKA,Creative,(i.redd.it),https://old.reddit.com/r/Rainbow6/comments/kdj50d/long_live_the_lord_tachanka/
10,My best siege clip to date. easily,Gameplay,(v.redd.it),https://old.reddit.com/r/Rainbow6/comments/keqsr6/my_best_siege_clip_to_date_easily/
9,"1 tap hip fire check this out",Gameplay,(v.redd.it),https://old.reddit.com/r/Rainbow6/comments/kdpx1t/1_tap_hip_fire_check_this_out/
8,Suggestion: Include the actual icons for attachments in the selection screen,Feedback,(i.redd.it),https://old.reddit.com/r/Rainbow6/comments/kdg92j/suggestion_include_the_actual_icons_for/
7,The 6.5 second Amaru ace,Gameplay,(v.redd.it),https://old.reddit.com/r/Rainbow6/comments/kest1w/the_65_second_amaru_ace/
6,TIL that’s frosts trapper headgear is an old technique used by people in northern regions where they carve shades out of bone to stop the glair from the snow.,Fluff,(i.redd.it),https://old.reddit.com/r/Rainbow6/comments/kgxf1l/til_thats_frosts_trapper_headgear_is_an_old/
5,Me and my homies played a ranked game and someone on the other team lobby froze so we invited the enemy team to a scribble.io and we’re playing in a lobby,Discussion,(i.redd.it),https://old.reddit.com/r/Rainbow6/comments/ke1m0b/me_and_my_homies_played_a_ranked_game_and_someone/
4,I die inside when this happened,Fluff,(v.redd.it),https://old.reddit.com/r/Rainbow6/comments/kfl54r/i_die_inside_when_this_happened/
3,Trying to get MVP in Ranked..,Fluff,(v.redd.it),https://old.reddit.com/r/Rainbow6/comments/kghekl/trying_to_get_mvp_in_ranked/
2,Time to make our boy Lt. Custard proud,Fluff,(i.redd.it),https://old.reddit.com/r/Rainbow6/comments/kfdu2t/time_to_make_our_boy_lt_custard_proud/
1,Give me the ACOG,Fluff,(i.redd.it),https://old.reddit.com/r/Rainbow6/comments/kfcmm7/give_me_the_acog/
