Points,Title,Flair,Post Type,Post Links
25,UPDATE: Hair gone chemo 50% done but WoW helping me through it all the way!,Fluff,(i.redd.it),https://old.reddit.com/r/wow/comments/kdgrje/update_hair_gone_chemo_50_done_but_wow_helping_me/
24,pugging mythics as a healer,Humor / Meme,(i.redd.it),https://old.reddit.com/r/wow/comments/keb65e/pugging_mythics_as_a_healer/
23,Healing in Shadowlands,Humor / Meme,(i.redd.it),https://old.reddit.com/r/wow/comments/kg6eno/healing_in_shadowlands/
22,Please don't fix this Blizzard.,Humor / Meme,(v.redd.it),https://old.reddit.com/r/wow/comments/kdklo1/please_dont_fix_this_blizzard/
21,Cursed Zandaren and Pandalari,Humor / Meme,(i.redd.it),https://old.reddit.com/r/wow/comments/kgwpra/cursed_zandaren_and_pandalari/
20,My boomie is learning to fly with the Kyrian,Humor / Meme,(v.redd.it),https://old.reddit.com/r/wow/comments/kgf3z1/my_boomie_is_learning_to_fly_with_the_kyrian/
19,Blizzard this is the best start to an expansion in a long time. Please don't turn Torghast into a slugfest!,Discussion,(self.wow),https://old.reddit.com/r/wow/comments/kdrty2/blizzard_this_is_the_best_start_to_an_expansion/
18,Amateur wall-art inspired by Ardenweald (by me),Art,(i.redd.it),https://old.reddit.com/r/wow/comments/kd03pr/amateur_wallart_inspired_by_ardenweald_by_me/
17,I can’t believe they’ve done this,Humor / Meme,(i.imgur.com),https://old.reddit.com/r/wow/comments/kem7yg/i_cant_believe_theyve_done_this/
16,Updating Torghast this week,Discussion,(us.forums.blizzard.com),https://old.reddit.com/r/wow/comments/kf515j/updating_torghast_this_week/
15,GG: I now hate Torghast more than Islands. You showed me,Complaint,(self.wow),https://old.reddit.com/r/wow/comments/kevsg5/gg_i_now_hate_torghast_more_than_islands_you/
14,I can't believe this disconnected in the middle of a Torghast run...,Discussion,(self.wow),https://old.reddit.com/r/wow/comments/kft2ce/i_cant_believe_this_disconnected_in_the_middle_of/
13,My best friend got me the best mousepad ever for my birthday (that's her belf being terrorized by my warlock),Fluff,(i.redd.it),https://old.reddit.com/r/wow/comments/kgrt16/my_best_friend_got_me_the_best_mousepad_ever_for/
12,If I had one hour to live I'd spend it playing in the Maw,Feedback,(self.wow),https://old.reddit.com/r/wow/comments/kfow0z/if_i_had_one_hour_to_live_id_spend_it_playing_in/
11,Goodjob blizzard this patch made torghast a lot of fun!,Complaint,(self.wow),https://old.reddit.com/r/wow/comments/ke4beg/goodjob_blizzard_this_patch_made_torghast_a_lot/
10,Please don't fix this one either Blizzard,Humor / Meme,(v.redd.it),https://old.reddit.com/r/wow/comments/kf7nc3/please_dont_fix_this_one_either_blizzard/
9,When I drop 750 Anima and realize that it doesn't actually take me to my covenant...,Humor / Meme,(i.redd.it),https://old.reddit.com/r/wow/comments/kehbz6/when_i_drop_750_anima_and_realize_that_it_doesnt/
8,Identified root cause of age old bug: Mouse randomly jumping to the middle of the screen,Complaint,(self.wow),https://old.reddit.com/r/wow/comments/kfko53/identified_root_cause_of_age_old_bug_mouse/
7,Send The Guy Who Made My Legendary A Piece Of Grass Because His Name Was Moo. Got This As A Response,Fluff,(i.redd.it),https://old.reddit.com/r/wow/comments/kgj50e/send_the_guy_who_made_my_legendary_a_piece_of/
6,Posting every day until Blizzard fixes Legion content/raid scaling. Day 1.,Complaint,(self.wow),https://old.reddit.com/r/wow/comments/kdfoxy/posting_every_day_until_blizzard_fixes_legion/
5,Noticed this while selling some junk,Humor / Meme,(i.redd.it),https://old.reddit.com/r/wow/comments/kfdus1/noticed_this_while_selling_some_junk/
4,They added a Larion transport wich takes you from the Elysian Hold to the dungeon entrance & back,Tip / Guide,(v.redd.it),https://old.reddit.com/r/wow/comments/kffxq9/they_added_a_larion_transport_wich_takes_you_from/
3,“I wanna learn how to play WoW to surprise my boyfriend.” UPDATE:,Fluff,(self.wow),https://old.reddit.com/r/wow/comments/kd344i/i_wanna_learn_how_to_play_wow_to_surprise_my/
2,Finally my laziness pays off,Fluff,(imgur.com),https://old.reddit.com/r/wow/comments/kfnf8p/finally_my_laziness_pays_off/
1,Blizzard Torghast was at least fun for tanks and healers. You supposed to make it fun for DPS specs too not make it not fun for tanks and healers.,Complaint,(self.wow),https://old.reddit.com/r/wow/comments/kea2pn/blizzard_torghast_was_at_least_fun_for_tanks_and/
